"","date_utc","timestamp","title","text","subreddit","comments","url"
"1","2023-06-29",1688047885,"Supreme Court Rules Against Affirmative Action","","news",5435,"https://www.reddit.com/r/news/comments/14m61u8/supreme_court_rules_against_affirmative_action/"
"2","2023-07-03",1688394305,"Activists spurred by affirmative action ruling sue Harvard over legacy admissions","","news",1245,"https://www.reddit.com/r/news/comments/14pkiev/activists_spurred_by_affirmative_action_ruling/"
"3","2015-12-09",1449670075,"SCOTUS Hears Case That Could Kill College Affirmative Action","","news",3765,"https://www.reddit.com/r/news/comments/3w2pyc/scotus_hears_case_that_could_kill_college/"
"4","2014-04-22",1398177518,"U.S. Supreme Court votes 7-2 that states may end affirmative action without violating Constitution","","news",1030,"https://www.reddit.com/r/news/comments/23oji9/us_supreme_court_votes_72_that_states_may_end/"
"5","2017-08-02",1501680754,"Justice Department plans new project to sue universities over affirmative action policies","","news",1900,"https://www.reddit.com/r/news/comments/6r46er/justice_department_plans_new_project_to_sue/"
"6","2022-01-24",1643040698,"Supreme Court will consider challenge to affirmative action in college admissions","","news",653,"https://www.reddit.com/r/news/comments/sbpnz0/supreme_court_will_consider_challenge_to/"
"7","2018-10-16",1539651455,"Affirmative action: Harvard racial admissions trial begins","","news",625,"https://www.reddit.com/r/news/comments/9oir9i/affirmative_action_harvard_racial_admissions/"
"8","2014-04-22",1398176475,"Supreme Court Upholds Michigan's Ban on Affirmative Action in College Admissions","","news",322,"https://www.reddit.com/r/news/comments/23oht3/supreme_court_upholds_michigans_ban_on/"
"9","2020-11-04",1604522020,"California Proposition 16 Election Results: Repeal Ban on Affirmative Action","","news",199,"https://www.reddit.com/r/news/comments/jo4e0h/california_proposition_16_election_results_repeal/"
"10","2014-11-18",1416276595,"Lawsuits filed Monday against Harvard University and the University of North Carolina at Chapel Hill argue that affirmative action policies should be banned at colleges across the nation.","","news",45,"https://www.reddit.com/r/news/comments/2mmfpj/lawsuits_filed_monday_against_harvard_university/"
"11","2013-06-24",1372084336,"Supreme Court sends affirmative action case back to lower court","","news",24,"https://www.reddit.com/r/news/comments/1gyxkc/supreme_court_sends_affirmative_action_case_back/"
"12","2014-04-22",1398176677,"U.S. Supreme Court upholds Michigan's ban on affirmative action in college admissions","","news",55,"https://www.reddit.com/r/news/comments/23oi4f/us_supreme_court_upholds_michigans_ban_on/"
"13","2017-11-21",1511296077,"Harvard affirmative action 'investigated'","","news",91,"https://www.reddit.com/r/news/comments/7ekwin/harvard_affirmative_action_investigated/"
"14","2014-06-07",1402176034,"South Africa's policy of race-based affirmative action is killing babies and must be scrapped, the country's Institute of Race Relations said. The institute said black empowerment policies had seen unqualified people appointed to positions where their incompetence hit poor and vulnerable communities","","news",2,"https://www.reddit.com/r/news/comments/27kp0t/south_africas_policy_of_racebased_affirmative/"
"15","2015-12-11",1449802796,"Justice Scalia under fire for race comments during affirmative action argument","","news",64,"https://www.reddit.com/r/news/comments/3wbjhw/justice_scalia_under_fire_for_race_comments/"
"16","2016-10-27",1477595230,"UT Young Conservatives' 'affirmative action bake sale' draws hundreds of angry students | Higher Education","","news",58,"https://www.reddit.com/r/news/comments/59pu92/ut_young_conservatives_affirmative_action_bake/"
"17","2020-06-16",1592333809,"University of California votes to restore affirmative action nearly 24 years after it was outlawed","","news",31,"https://www.reddit.com/r/news/comments/haa7yz/university_of_california_votes_to_restore/"
"18","2012-11-15",1353020057,"Michigan's ban on affirmative action in college admissions was declared unconstitutional Thursday by a deeply divided federal appeals court, six years after state voters said race could not be an issue in choosing students. ","","news",3,"https://www.reddit.com/r/news/comments/139kon/michigans_ban_on_affirmative_action_in_college/"
"19","2014-04-29",1398783204,"Affirmative Action's Next Phase May Target Class, Not Race","","news",28,"https://www.reddit.com/r/news/comments/24a3pq/affirmative_actions_next_phase_may_target_class/"
"20","2014-04-22",1398178382,"Supreme Court upholds the right of states to ban affirmative action.","","news",3,"https://www.reddit.com/r/news/comments/23okrl/supreme_court_upholds_the_right_of_states_to_ban/"
"21","2011-07-01",1309556607,"Michigan ban on Affirmative Action for college admissions struck down by 6th Circuit US Court of Appeals","","news",18,"https://www.reddit.com/r/news/comments/iejx6/michigan_ban_on_affirmative_action_for_college/"
"22","2015-12-10",1449762975,"Justice Scalia's Racially Charged Remarks Stoke the Affirmative Action Debate","","news",37,"https://www.reddit.com/r/news/comments/3w8jph/justice_scalias_racially_charged_remarks_stoke/"
"23","2011-09-26",1317042189,"""Affirmative action"" bake sale by student Republicans to protest a bill to let the University of California and the California State University to again use ethnicity in student admissions hits a nerve on campus. ","","news",12,"https://www.reddit.com/r/news/comments/krs0y/affirmative_action_bake_sale_by_student/"
"24","2012-02-27",1330375073,"55% Oppose Affirmative Action Policies for College Admissions","","news",15,"https://www.reddit.com/r/news/comments/q8kk0/55_oppose_affirmative_action_policies_for_college/"
"25","2016-05-31",1464702384,"More Than 150 Organizations Sign Letter for Affirmative Action Following Ivy League Complaint","","news",7,"https://www.reddit.com/r/news/comments/4lv9ve/more_than_150_organizations_sign_letter_for/"
"26","2014-06-23",1403487363,"Sotomayor: Affirmative Action Options Dont Work","","news",15,"https://www.reddit.com/r/news/comments/28u3zz/sotomayor_affirmative_action_options_dont_work/"
"27","2012-10-02",1349205551,"Affirmative Action (the policy that allows colleges to accept or deny applicants based on race) will reach the Supreme Court next week!","","news",6,"https://www.reddit.com/r/news/comments/10ty18/affirmative_action_the_policy_that_allows/"
"28","2015-12-10",1449711378,"U.S. top court divided over affirmative action in college admissions","","news",9,"https://www.reddit.com/r/news/comments/3w5nuk/us_top_court_divided_over_affirmative_action_in/"
"29","2012-10-09",1349747636,"Supreme Court to hear case concerning affirmative action in school admissions.","","news",0,"https://www.reddit.com/r/news/comments/1168eq/supreme_court_to_hear_case_concerning_affirmative/"
"30","2011-10-17",1318818577,"College affirmative action nears its last stand","","news",3,"https://www.reddit.com/r/news/comments/leo8h/college_affirmative_action_nears_its_last_stand/"
"31","2011-12-01",1322740703,"Research finds that affirmative action hurts minorities","","news",1,"https://www.reddit.com/r/news/comments/mw1qf/research_finds_that_affirmative_action_hurts/"
"32","2012-09-30",1349008493,"Affirmative action, rights cases await U.S. Supreme Court","","news",0,"https://www.reddit.com/r/news/comments/10pidg/affirmative_action_rights_cases_await_us_supreme/"
"33","2011-08-07",1312732265,"Under the U.S. Supreme Court: Race-based affirmative action in peril","","news",11,"https://www.reddit.com/r/news/comments/jblc3/under_the_us_supreme_court_racebased_affirmative/"
"34","2014-04-22",1398183530,"Supreme Court Upholds Michigan's Ban On Affirmative Action","","news",2,"https://www.reddit.com/r/news/comments/23ot4y/supreme_court_upholds_michigans_ban_on/"
"35","2014-04-17",1397704173,"Black student is denied acceptance to U of M Michigan with a 3.5 gpa and an ACT score of 23. She is now fighting to reinstate affirmative action so that she can be accepted.","","news",22,"https://www.reddit.com/r/news/comments/238n9l/black_student_is_denied_acceptance_to_u_of_m/"
"36","2012-02-22",1329879628,"Supreme Court to Hear Affirmative Action Case","","news",0,"https://www.reddit.com/r/news/comments/q0c0x/supreme_court_to_hear_affirmative_action_case/"
"37","2014-07-22",1406060336,"""The University of Wisconsin-Madison has taken affirmative action to a new level. Instead of giving grades on how well you do in class, grades will be determined by race.""","","news",9,"https://www.reddit.com/r/news/comments/2bfebs/the_university_of_wisconsinmadison_has_taken/"
"38","2014-04-22",1398178186,"Supreme Court upholds Michigan's ban on affirmative action in college admissions","","news",2,"https://www.reddit.com/r/news/comments/23okht/supreme_court_upholds_michigans_ban_on/"
"39","2011-10-01",1317505284,"Brown weighs bill challenging ban on affirmative action: The measure could put race and gender back into the admissions process at California's public universities 15 years after the state's voters banned affirmative action.","","news",0,"https://www.reddit.com/r/news/comments/kxsyg/brown_weighs_bill_challenging_ban_on_affirmative/"
"40","2012-02-23",1329956057,"Supreme Court to Hear Affirmative Action Case - NYTimes.com","","news",1,"https://www.reddit.com/r/news/comments/q1pdy/supreme_court_to_hear_affirmative_action_case/"
"41","2014-06-02",1401748844,"New FAA hiring policy pushes affirmative action instead of hiring most qualified candidates","","news",6,"https://www.reddit.com/r/news/comments/275h5t/new_faa_hiring_policy_pushes_affirmative_action/"
"42","2013-06-24",1372082983,"Today The U.S Supreme Court may hand down it's decision on two landmark same sex marriage cases, affirmative action and the Voting Rights Act of 1965. This is a live running thread of the action.","","news",5,"https://www.reddit.com/r/news/comments/1gyw76/today_the_us_supreme_court_may_hand_down_its/"
"43","2014-04-22",1398182781,"Supreme Court upholds Michigan affirmative action ban","","news",0,"https://www.reddit.com/r/news/comments/23orwd/supreme_court_upholds_michigan_affirmative_action/"
"44","2014-04-22",1398182348,"U.S. Supreme Court upholds Michigan anti-affirmative action law, California's Prop. 209 stands","","news",2,"https://www.reddit.com/r/news/comments/23or64/us_supreme_court_upholds_michigan_antiaffirmative/"
"45","2014-11-19",1416364982,"Harvard University Sued for Affirmative Action","","news",4,"https://www.reddit.com/r/news/comments/2mqda3/harvard_university_sued_for_affirmative_action/"
"46","2013-06-11",1370961916,"NBC News/WSJ poll: Affirmative action support at historic low","","news",0,"https://www.reddit.com/r/news/comments/1g4g1s/nbc_newswsj_poll_affirmative_action_support_at/"
"47","2013-06-20",1371754117,"Supreme Court ruled on three cases today but still nothing on affirmative action or gay and voting rights","","news",0,"https://www.reddit.com/r/news/comments/1gqson/supreme_court_ruled_on_three_cases_today_but/"
"48","2012-06-02",1338629319,"Romney Scuttled, Revived Mass. Affirmative Action as Gov.","","news",0,"https://www.reddit.com/r/news/comments/uh01x/romney_scuttled_revived_mass_affirmative_action/"
"49","2013-06-20",1371739765,"Supreme Court Holds Off On Rulings On Affirmative Action, Voting Rights And Gay Marriage","","news",1,"https://www.reddit.com/r/news/comments/1gq9tf/supreme_court_holds_off_on_rulings_on_affirmative/"
"50","2015-09-12",1442052389,"UC Berkeley Has a Plan to Boost Black Student Numbers After Affirmative Action Ban","","news",5,"https://www.reddit.com/r/news/comments/3kne67/uc_berkeley_has_a_plan_to_boost_black_student/"
"51","2019-03-16",1552779322,"Affirmative Action in the Berlin Police","","news",0,"https://www.reddit.com/r/news/comments/b1yuei/affirmative_action_in_the_berlin_police/"
"52","2014-04-22",1398179989,"Supreme Court upholds Michigan affirmative action ban","","news",5,"https://www.reddit.com/r/news/comments/23onbk/supreme_court_upholds_michigan_affirmative_action/"
"53","2012-10-10",1349834074,"Is affirmative action going to be fully eliminated? SCOTUS Justices to re-examine use of race in college admissions - CNN.com","","news",0,"https://www.reddit.com/r/news/comments/1188yw/is_affirmative_action_going_to_be_fully/"
"54","2012-10-10",1349903364,"Supreme Court justices vigorously challenged a University of Texas admissions program that favors some African-American and Hispanic applicants on Wednesday in a case that could determine how universities use affirmative action at campuses nationwide.","","news",0,"https://www.reddit.com/r/news/comments/119tw8/supreme_court_justices_vigorously_challenged_a/"
"55","2013-03-27",1364348165,"Two affirmative action cases before the Supreme Court could broadly impact college admissions","","news",1,"https://www.reddit.com/r/news/comments/1b2zse/two_affirmative_action_cases_before_the_supreme/"
"56","2012-10-11",1349949973,"Justice Kennedy the key to campus affirmative action
","","news",0,"https://www.reddit.com/r/news/comments/11awq6/justice_kennedy_the_key_to_campus_affirmative/"
"57","2014-04-22",1398179391,"Supreme Court Upholds Michigans Affirmative Action Ban","","news",2,"https://www.reddit.com/r/news/comments/23omd2/supreme_court_upholds_michigans_affirmative/"
"58","2013-06-24",1372110173,"Justices Send Affirmative Action Case to Lower Court","","news",0,"https://www.reddit.com/r/news/comments/1gzv2v/justices_send_affirmative_action_case_to_lower/"
"59","2014-06-23",1403525605,"Justice Sonia Sotomayor defends affirmative action","","news",6,"https://www.reddit.com/r/news/comments/28v6wn/justice_sonia_sotomayor_defends_affirmative_action/"
"60","2013-06-24",1372089484,"Supreme Court sidesteps big ruling on Texas Affirmative Action case","","news",0,"https://www.reddit.com/r/news/comments/1gz3e0/supreme_court_sidesteps_big_ruling_on_texas/"
