"","date_utc","timestamp","title","text","subreddit","comments","url"
"Affirmative Action  Harming Asians Most","2013-08-07",1375846976,"Affirmative Action  Harming Asians Most","I hate how Asians are stereotyped as being superior to Whites in college admissions, which forces them to limit their ranges of Asian students in incoming classes. That combined with the need to have diverse females and males screws over Asians. I was told by a former UPenn admissions officer that the worst demographic to be is Asian Male for all the reasons you can think of.

The NYT article Little Asia on the Hill explores the little known problem of Affirmative Action that affects Asian Americans. The article begins by describing how UC Berkley had a record high for Asians in their freshman class and what it was like for a student to be among such a large population of Asian students in the university.

&gt;    But 10 years after California passed Proposition 209, voting to eliminate racial preferences in the public sector, university administrators find such balance harder to attain. At the same time, affirmative action is being challenged on a number of new fronts, in court and at state ballot boxes. And elite colleges have recently come under attack for practicing it  specifically, for bypassing highly credentialed Asian applicants in favor of students of color with less stellar test scores and grades.

There have been long running suspicions among the Asian American community that they were often denied admission or wait-listed to make room for other students considered to be disadvantaged minorities. I find it interesting that although universities pride themselves on being tolerant and diverse, their admissions office uses a combination of stereotypes and impossible standards to create what they believe to be an incoming class with perfect diversity. It seems absurd that admissions officials would assess an Asian student at a much higher standard than his White counterparts because they are a supposedly superior Model Minority while judging African-Americans and Hispanics at a much lower standard using Whites as a neutral benchmark because they are implied to be inferior disadvantaged minorities. Additionally, it is even more racist to use Whites as a neutral standard in judging which groups are superior to receive harder burdens from the admissions officers, while using a lesser standard on the other groups, which appear to reaffirm the age-old American perception that Asians are superior while Blacks/Hispanics are not.

&gt;    Asians have become the new Jews, in the phrase of Daniel Golden, whose recent book, The Price of Admission: How Americas Ruling Class Buys Its Way Into Elite Colleges  and Who Gets Left Outside the Gates, is a polemic against university admissions policies. Mr. Golden, a reporter for The Wall Street Journal, is referring to evidence that, in the first half of the 20th century, Ivy League schools limited the number of Jewish students despite their outstanding academic records to maintain the primacy of upper-class Protestants. Today, he writes, Asian-Americans are the odd group out, lacking racial preferences enjoyed by other minorities and the advantages of wealth and lineage mostly accrued by upper-class whites. Asians are typecast in college admissions offices as quasi-robots programmed by their parents to ace math and science.

&gt;    As if to illustrate the point, a study released in October by the Center for Equal Opportunity, an advocacy group opposing race-conscious admissions, showed that in 2005 Asian-Americans were admitted to the University of Michigan, Ann Arbor, at a much lower rate (54 percent) than black applicants (71 percent) and Hispanic applicants (79 percent)  despite median SAT scores that were 140 points higher than Hispanics and 240 points higher than blacks.

&gt;    To force the issue on a legal level, a freshman at Yale filed a complaint in the fall with the Department of Educations Office of Civil Rights, contending he was denied admission to Princeton because he is Asian. The student, Jian Li, the son of Chinese immigrants in Livingston, N.J., had a perfect SAT score and near-perfect grades, including numerous Advanced Placement courses.

&gt;    This is just a very, very egregious system, Mr. Li told me. Asians are held to different standards simply because of their race.

&gt;    To back his claim, he cites a 2005 study by Thomas J. Espenshade and Chang Y. Chung, both of Princeton, which concludes that if elite universities were to disregard race, Asians would fill nearly four of five spots that now go to blacks or Hispanics. Affirmative action has a neutral effect on the number of whites admitted, Mr. Li is arguing, but it raises the bar for Asians. The way Princeton selects its entering class, Mr. Li wrote in his complaint, seems to be a calculated move by a historically white institution to protect its racial identity while at the same time maintaining a facade of progressivism.

&gt;    Private institutions can commit to affirmative action, even with state bans, but federal money could be revoked if they are found to be discriminating. Mr. Li is seeking suspension of federal financial assistance to Princeton. Im not seeking anything personally, he says. Im happy at Yale. But I grew up thinking that in America race should not matter.

Affirmative Action is not a Black and White issue as most people are led to believe although it seems that way because of the lack of Asian voices in this controversial issue. The 2005 study also pointed out that Asian applicants had to score at least 50 points higher on the SAT than other applicants just to get an equal chance for admission Blacks and Hispanics still have a strong chance even if they score 200 and 185 points below other applicants. The URL to access the Princeton study is http://opr.princeton.edu/faculty/Tje/EspenshadeSSQPtII.pdf

I am troubled that elite universities in the past have limited admission from Jewish students in a sad attempt to preserve WASP culture and now I am troubled that universities are making an effort to limit Asian students in an attempt to promote diversity to accommodate certain minorities. What is more disturbing is that Asians as a minority group have lower admission rates than other defined minority groups in universities despite meeting or exceeding admission requirements. After universities such as Berkeley removed Affirmative Action, diversity was still intact except there was a decrease of certain minority groups that would have gotten in from this generally flawed system.

&gt;    Ive heard from Latinos and blacks that Asians should not be considered a minority at all, says Elaine Kim, a professor of Asian-American studies at Berkeley. What happened after they got rid of affirmative action has been a disaster  for blacks and Latinos. And for Asians its been a disaster because some people think the campus has become all-Asian.

In spite of all the controversy, Affirmative Action is actually promoting racial tensions to a large extent. It had been noted that Whites who complained about Affirmative Action sound like racists, now African-Americans and Hispanics who complain about the removal of the system are developing hostile attitudes towards Asians who have been increasingly admitted in universities that have merit-based admissions in their place. At the same time, diversity has dropped which does take away from the college experience for a large extent based on observations on Busch and Livingston campus versus the diverse student life on College Avenue.

&gt;    One leading critic of bringing affirmative action back to Berkeley is David A. Hollinger, chairman of its history department and author of Post-Ethnic America: Beyond Multiculturalism. He supported racial preferences before Proposition 209, but is no longer so sure. You could argue that the campus is more diverse now, because Asians comprise so many different cultures, says Dr. Hollinger. A little more than half of Asian freshmen at Berkeley are Chinese, the largest group, followed by Koreans, East-Indian/Pakistani, Filipino and Japanese.

&gt;   Dr. Birgeneau agrees on at least one point: I think were now at the point where the category of Asian is not very useful. Koreans are different from people from Sri Lanka and theyre different than Japanese. And many Chinese-Americans are a lot like Caucasians in some of their values and areas of interest.

The system used to categorise minorities is also flawed. Both individuals point out that Asians are made up of several ethnic groups such as Chinese, Korean, Indian, Japanese and Vietnamese and it is extremely insulting to consider each ethnicity as one and the same. Despite this, Hollinger makes a valid point that diversity did not decrease when Affirmative Action was abolished in those university, but it actually grew due to the increased numbers of Asians that are able to mingle with one another more than ever.

Personally, I would replace race-based affirmative action with socioeconomic affirmative action containing a merit-based component. I think that affirmative action should address actual inequity, rather than historical inequity faced by others of the same skin color. So if we can address socioeconomic disadvantage, there is no reason use old stereotypes to set different admission standards for minorities at the expense of Asians.","asianamerican",26,"https://www.reddit.com/r/asianamerican/comments/1juzmv/affirmative_action_harming_asians_most/"
"An Oldie but a goodie 2013 NYT Piece: Asian Quotas in Elite Colleges","2015-12-09",1449630415,"An Oldie but a goodie 2013 NYT Piece: Asian Quotas in Elite Colleges","http://www.nytimes.com/roomfordebate/2012/12/19/fears-of-an-asian-quota-in-the-ivy-league/discrimination-is-obvious

At a time where many university students are examining the role of race in places of elite and privileged learning, many on this forum have asked what our role as AAs are among other minority groups. 

One of the things to highlight may be how elite institutions (e.g. the Ivy League), have put into place discriminatory quotas in AA admissions. Several peer reviewed academic papers have concluded that there is very real statistical evidence that such a quota exists (ironically, the more heavily cited ones come from Princeton). 

Perhaps if we too are to join other PoC in their fight, perhaps our place is to also ask elite institutions for transparency. The Ivy League notoriously keeps admissions statistics private, however, if they are to have a fair and balanced admission strategy, perhaps they too should not worry about releasing the GPAs, SATs, and other factors by race. ","asianamerican",7,"https://www.reddit.com/r/asianamerican/comments/3w0u9e/an_oldie_but_a_goodie_2013_nyt_piece_asian_quotas/"
"More numbers on Asian discrimination in college admissions","2012-12-23",1356244788,"More numbers on Asian discrimination in college admissions","","asianamerican",3,"https://www.reddit.com/r/asianamerican/comments/15bfe9/more_numbers_on_asian_discrimination_in_college/"
"Why The Strategy To End Discrimination Against Asian Americans in Admissions Is All Wrong","2017-04-14",1492175698,"Why The Strategy To End Discrimination Against Asian Americans in Admissions Is All Wrong","","asianamerican",17,"https://www.reddit.com/r/asianamerican/comments/65cfv3/why_the_strategy_to_end_discrimination_against/"
"Is an Asian-American university the answer?","2023-11-07",1699348977,"Is an Asian-American university the answer?","Asian-American students applying to Harvard have been discriminated against by admissions officials.

So is the solution a university (Ivy League-level) founded and run by Asian-Americans?

The admissions officials would be Asian-American, and the students admitted would be mostly Asians (from the USA or Asia).  

Problem of racial discrimination against Asians solved.

How's that for an idea?

&amp;#x200B;","asianamerican",9,"https://www.reddit.com/r/asianamerican/comments/17pqfil/is_an_asianamerican_university_the_answer/"
"Does this sub really have a disdain for Affirmative Action?","2019-04-23",1556041025,"Does this sub really have a disdain for Affirmative Action?","After looking up some information about Affirmative Action, I also saw a reddit thread on this sub with many people saying AA shouldn't have been implemented to begin with. After searching ""Affirmative Action Reddit"", I came across even more posts and comments like this from this sub. I want to present an argument, and then a question based on the premise of the argument. I myself am Asian American, so I had to fill in the box when applying for schools too you know. Anyways.

Let's start with median incomes in the US

Asians - 80K  
White - 61K  
US median - 57K  
Pacific Islander - 57K  
Hispanic/Latino - 46K  
Other races - 44K  
Native American - 39K  
Black - 38K

So basically, Affirmative Action serves to be one of many, MANY initiatives aiming to get any race under the US median TO the US median. In theory, if all humans are capable of the same achievements in our civilization then discrepancies shouldn't be this great. But it's very obvious how the median incomes drop hard between Pacific Islanders and Hispanic/Latinos, and once again down to Native Americans and Blacks considered against the ""others"" option.

It may be worth it to also present these groups by per capita income as well

Asians - 34K  
White - 32K  
Pacific Islander - 21K  
Black - 20K  
Native American - 18K  
Hispanic/Latino - 16K

Amazingly, the drop off happens after White and that's it. Black Americans aren't actually at the bottom per-capita, which probably implies that there are more people poorer than the median than richer. Just to be clear, since the per-capita incomes are all less than the medians here, ALL of America's per-capita incomes have a bell curve that skews left. [An example just to be absolutely sure we're on the same page](http://jse.amstat.org/v13n2/vonhippel_figure1.gif). It's just that some skew harder or have less of a tail, implied by the re-ordering.

Back to affirmative action. Basically, Affirmative Action is a policy implemented by certain public systems, and even the private sector, to determine who is suitable for acceptance into a school, workplace, etc. when competition is present. It leads to outcomes where if two people of similar merit went for a job, but one was from a race which has a higher per-capita income, then they might be not be favoured. This is seen as controversial by many, because it can be seen as racist.

I believe that, despite being Asian American, I don't really mind Affirmative Action as a concept. I DO believe it needs reform, especially since poor whites are left behind by these programs, but it is sound in-theory simply because the different in income stats is so great that there's CLEARLY a problem that needs fixing here just due to America's history. If initiatives aren't taken to alleviate these problems in a meritocracy, then we could end up repeating the cycle that brought us to this point, as Americans.  


1. These income ratios between races would stay the same
2. After some time, the lesser income races would get profiled as uneducated, dangerous, etc. simply due to their lower average income (even when they're middle class).
3. Successful kids from lower income races succeed, and start to favour affirmative action due to these problems.
4. Affirmative Action is implemented
5. Affirmative Action is cut due to being against the idea of a perfect meritocracy
6. Repeat?  


Let me put it this way. What would you, as a person, see as more impressive? A black kid born into a low-income neighborhood with parents that value education but absolutely toxic bullies in elementary and middle school, and they don't have the means to send their kid to a private school. This black kid has to stay away from every bad influence he meets, even if that means becoming a total outcast. Also, he starts working a job while in highschool while some of his friends flunk entirely. He gets a 3.8 average in highschool regardless. He's also shown himself to have a kind heart and a passion for helping those around him. Or. A white kid born into a family where the father does Real-Estate somewhat successfully and the mother works in IT in a small company. This white kid's parents also value education, and they're able to send him to a private school as such. He gets a 3.6 there. However, colleges weigh students from that private school as 0.4 GPA higher relative to the black kid's public school. So he would effectively be a 4.0 student in public school, in their eyes. That said, he didn't really get bullied, and most bad influences were only as bad as they needed to be without actually doing bad academically. The truly bad influences, the types of guys that will flunk out, he also avoids just like the black kid, but at a private school there aren't many of those (I went to a private school and there was only 1 guy like that, period). Overall, he's a good kid with a kind heart too. Volunteers and does service all the time. Honestly, it may be hard, but I UNDERSTAND the reason AA would pick the black kid. By giving this black kid more resources than he ever had in the past, you have the potential to make a successful black kid, then a successful black adult, and then a successful black adult who also uplifts his originally low-income neighborhood if he chooses to stay around that culture. I've seen it with my own eyes too. I go to a mosque here in Atlanta in a black neighborhood occasionally, and the adults that lead this mosque are very proper and are always making strides to give back to the community. They've pretty much changed the culture in their part of Atlanta alongside the three churches and the school in that area, through what I've gathered talking to them (they're old people). I can affirm this, because going a few blocks east or west of that neighborhood brings you to uneducated Atlanta, like Pittsburgh or Lakewood. 

&amp;#x200B;

I understand that the context of AA for Asian Americans is that Asians have higher incomes and education, and it's HEAVILY due to the amount of vetting and barriers to immigration (AKA brain-drain from our ancestor countries ugh). But beyond this, I don't really see this as a big deal. I still got into the college I wanted to, a very prestigious one at that (Emory). In fact, my background of being the son of two doctors that went to a private school probably has something to do with it, considering I got a 3.2 in highschool. In the grand scheme of American civilization, I'm willing to have a slightly higher bar for success than others if it means that America as a whole is benefiting tenfold. Now, AGAIN, there are so many flaws with actual implemented AA, that I think prevents me from supporting it as it is now. I believe that it needs to be reformed so that it targets low-income situations much more than situations by race. There was a case of a low-income Asian being discriminated in Harvard admissions over a middle-income black kid that led to controversy a while back. In subsequent years, [movements](http://time.com/5425147/harvard-affirmative-action-trial-asian-american-students/) have been made to combat this problem, and I do agree with it to a certain extent. We need to target concentrated poverty, more or less. But otherwise I do support the mission it is trying to achieve. *The racial implications of AA only exist because #2 above happens, people make stereotypes of races based on the average income of that race and how people of those incomes usually act or live. And this leads to prejudice. If people weren't prone to casual racism, I do believe there'd be less support for AA. But is that reality? It's up to you to decide.*

But enough about what I think. My original question was what YOU guys think?","asianamerican",19,"https://www.reddit.com/r/asianamerican/comments/bgj9bw/does_this_sub_really_have_a_disdain_for/"
"What is your opinion on affirmative action?","2018-04-04",1522876498,"What is your opinion on affirmative action?","I recently read this vox article https://www.vox.com/2018/3/28/17031460/affirmative-action-asian-discrimination-admissions and wanted to see what your views are. Whether you are for or against, I just hope to start a meaningful discussion. Growing up I remember thinking it was unfair that we had to work so much harder to get into the same schools that my friends got into despite having better grades. But now coming out of a 4 year college, I genuinely enjoyed the diversity and hope kids in the future can experience it as well as having other people experience asian culture. What are your thoughts?","asianamerican",13,"https://www.reddit.com/r/asianamerican/comments/89tkzl/what_is_your_opinion_on_affirmative_action/"
"The Ivy League is broken and only standardized tests can fix it - Prof. Steven Pinker","2014-09-06",1410035439,"The Ivy League is broken and only standardized tests can fix it - Prof. Steven Pinker","http://www.newrepublic.com/article/119321/harvard-ivy-league-should-judge-students-standardized-tests

Written by Steven Pinker.  He's a notable scientist and a Harvard professor, and here's his take.  Although he references Ron Unz's famous piece on Asian-American discrimination, this isn't just about Asian-Americans.  Affirmative action is a crux issue within our community, so it's nice to have one of today's great minds give us their opinion on this.

I'm pretty outspoken about how horrible holistic admissions or affirmative action are, and how meritocratic admissions is both more ethical and superior in student body.  On ethical grounds alone, I'm against systemic racism.  However, I suspect Pinker's thoughts on it are of more interest than mine.","asianamerican",36,"https://www.reddit.com/r/asianamerican/comments/2fnx0i/the_ivy_league_is_broken_and_only_standardized/"
