"","date_utc","timestamp","title","text","subreddit","comments","url"
"Asian American Discrimination in Harvard Admissions | European Economic Review | Arcidiacono, Kinsler, and Ransom","2022-05-07",1651932442,"Asian American Discrimination in Harvard Admissions | European Economic Review | Arcidiacono, Kinsler, and Ransom","","asianamerican",35,"https://www.reddit.com/r/asianamerican/comments/uke1z5/asian_american_discrimination_in_harvard/"
"Does Harvard discriminate against Asians? In a case that could upend college admissions, the Ivy League goes on trial","2018-10-14",1539509847,"Does Harvard discriminate against Asians? In a case that could upend college admissions, the Ivy League goes on trial","","asianamerican",64,"https://www.reddit.com/r/asianamerican/comments/9o1jyx/does_harvard_discriminate_against_asians_in_a/"
"U.S. Senate: U.S. Senate Roll Call Votes 117th Congress ""To prohibit Federal funding for any institution of higher education that discriminates against Asian Americans in recruitment, applicant review, or admissions.""","2021-04-29",1619660718,"U.S. Senate: U.S. Senate Roll Call Votes 117th Congress ""To prohibit Federal funding for any institution of higher education that discriminates against Asian Americans in recruitment, applicant review, or admissions.""","","asianamerican",25,"https://www.reddit.com/r/asianamerican/comments/n0u3v1/us_senate_us_senate_roll_call_votes_117th/"
"Email from Harvard Asian American Alumni Alliance - thought it was a well written summary and worth sharing","2018-06-29",1530230598,"Email from Harvard Asian American Alumni Alliance - thought it was a well written summary and worth sharing","Dear H4A members,

This past week has seen a flood of coverage regarding the lawsuit against Harvard Admissions, with Asian Americans as a central focus.
 
As we have stated before, our board believes that the diversity of our campusof students, faculty, staff and curriculumis critical to a Harvard education, and we will continue to advocate on this front, including our current activism around Harvard's lack of an Asian American Studies program. We support an inclusive, whole-person admissions process that creates a student body that is diverse in many dimensions and is able to contribute to and make the most of a Harvard education. But we of course oppose quotas and any racial discrimination against Asian Americans or any students in this process. We encourage you to hold, as we do, these two separate ideas simultaneously.
 
The stakes of this lawsuit, which will likely go to trial in October, are high, as the decision could affect the future of inclusive, race-aware policies in schools, businesses and government. In an effort to get past the often inflammatory headlines, some of us have dug into the 1,000+ pages of data analysis produced by both parties in this case, which offer two very different points of view and two different statistical models bolstering those. There are many more months and perhaps years of arguments ahead, but we would like to highlight a few points.
 
For those of you not following the lawsuit closely since its filing in 2014, the case against Harvard is being led by Edward Blum, who claims that Harvards admissions policies discriminate against Asian Americans. He is an activist who has been trying to end policies that promote diversity and inclusion in many areas of American life. He was at the forefront in bringing down civil rights protections that benefited Asian Americans in the Voting Rights Act. He twice went to the Supreme Court on behalf of a white plaintiff in Fisher vs. University of Texas to end the consideration of race in admissions. After failing, he decided he needed Asian American plaintiffs, advertised for them and filed the lawsuit under the name Students for Fair Admissions (SFFA). While we agree that Harvard should not discriminate against Asian Americans or students of any race, his history gives us pause when considering his motives. We are also wary about Asian Americans being used as a wedge against other communities of color.
 
Note that SFFA's complaint seeks, in its words, ""A permanent injunction requiring Harvard to conduct all admissions in a manner that does not permit those engaged in the decisional process to be aware of or learn the race or ethnicity of any applicant for admission."" Blum has said he doesn't want Admissions to know even an applicant's name. 
 
Harvard has said that without a holistic admissions process that considers race as just one factor among many factors, it cannot create a campus that is diverse enough to fulfill its educational mission. Harvards analysis argues that contrary to the narrative we hear so often, inclusive approaches vs. race-blind ones to admitting a diverse student body lead to higher academic ratings for the whole class.
 
Harvards consideration of the whole candidate includes not only an Academic Rating but also an Extracurricular Rating, an Athletic Rating and a Personal Rating. The headline news two weeks ago was around the numerical Personal Ratings that Harvard admissions officers assign each applicant, as SFFA accused Harvard of systematically depressing those scores of Asian Americans, which are in aggregate lower than those of other candidates. This New York Times story outlines those and SFFAs other major assertions.
 
Harvard, which says it opposes and denies any racial discrimination, provides analysis showing no negative association with being Asian American as an applicant and contends that there is no evidence that admissions officers attempted to lower the Personal Ratings of Asian Americans. Harvard says the Personal Rating is not a personality score, as characterized by SFFA, but rather reflects information from the applicants essays, teacher and counselor recommendations and alumni interview reports that indicate whether the applicant will be the kind of student who will contribute to Harvard in the fullest. Harvards outside expert reports that the Personal Ratings scores line up with the recommendations and the interview reports.
 
It seems difficult from the available data to prove or disprove how being Asian American might affect any of the four main ratings, all of which include subjective elements. SFFAs analysis shows that the Academic and Extracurricular Ratings come in higher than expected for Asian Americans, so is that bias too, just of a positive kind? Or are the ratings simply a result of a straight evaluation of the available information? Do biases originate earlier and creep in through the high school reports? Are many Asian Americans raised in a way that discourages developing the very qualities that Harvard is seeking? A mix of all of the above?
 
The reports raise as many questions as they answer. Our expectation is that Harvard should be vigilant about about any potential bias, conscious or unconscious, for applicants of any race. We would expect to have an Admissions Office that is diverse itself and trained to evaluate cultural context and recognize implicit bias in the reports they receive and the way they assign their own ratings. We will push Admissions to learn more, but it has been difficult during an active lawsuit to get information beyond what it is in the briefs.
 
We will continue to follow this closely, to seek answers and to keep you posted. We plan to have a plenary session addressing these issues at our Third Summit, and we hope you will join us for this chance to hear national experts on this topic. 
 
For those of you who want to geek out on the data analysis, here are links to the filings from [Harvard](https://projects.iq.harvard.edu/diverse-education/statements) and [SFFA](https://studentsforfairadmissions.org/sffa-files-motion-for-summary-judgment-against-harvard/). There will be responses from each side through the summer and then the trial is expected to begin in October, so be prepared for much more data and spin. This [Times story](https://www.nytimes.com/2018/06/16/us/affirmative-action-asian-americans.html?hp&amp;action=click&amp;pgtype=Homepage&amp;clickSource=story-heading&amp;module=first-column-region&amp;region=top-news&amp;WT.nav=top-news) captures a range of Asian Americans' views. For those of you who were in the applicant pool under examination (Classes of 2014-2019), or have children in it, the issue of whether applicant files will be publicly released is still in dispute, and we will likely be hearing more about that soon.

Please feel free to send us your thoughts at [email] or on our FB page.

Sincerely,
 
The H4A Board and Executive Committee","asianamerican",36,"https://www.reddit.com/r/asianamerican/comments/8uonyt/email_from_harvard_asian_american_alumni_alliance/"
"Study: Elite Colleges Race-Conscious Admissions Discriminate Against Asian Applicants","2018-05-24",1527175741,"Study: Elite Colleges Race-Conscious Admissions Discriminate Against Asian Applicants","","asianamerican",9,"https://www.reddit.com/r/asianamerican/comments/8ltizb/study_elite_colleges_raceconscious_admissions/"
"Cornell, Columbia Accused of Discriminating Against Asian American Students in College Admissions","2016-09-14",1473870328,"Cornell, Columbia Accused of Discriminating Against Asian American Students in College Admissions","","asianamerican",46,"https://www.reddit.com/r/asianamerican/comments/52rbaj/cornell_columbia_accused_of_discriminating/"
"The Many Sins of College Admissions: Jeannie Suk Gersen writes about the conclusion to the court ruling on Harvard Universitys use of race in admissions, which alleged that the school discriminated against Asian-American applicants, from the federal judge Allison Burroughs.","2019-10-08",1570552134,"The Many Sins of College Admissions: Jeannie Suk Gersen writes about the conclusion to the court ruling on Harvard Universitys use of race in admissions, which alleged that the school discriminated against Asian-American applicants, from the federal judge Allison Burroughs.","","asianamerican",3,"https://www.reddit.com/r/asianamerican/comments/df2e3t/the_many_sins_of_college_admissions_jeannie_suk/"
"The Whole Student Debt Relief Movement....Hypocrisy?","2019-08-07",1565182193,"The Whole Student Debt Relief Movement....Hypocrisy?","Something I can't seem to shake as a Pakistani American is this whole movement. Much like the crack epidemic not given attention when it was a 'black problem', and need for 'intervention' to help opioid addicts who are now manly a white demographic, we have a similar analogy with Asian Americans.

To this very fucking day, Caucasian provosts (WASP/Jewish) routinely use non transparent admissions policies, while taking on huge grants and fellowships from taxpayer dollars (ie Pell) to deny  Asian Americans admissions into their universities. A lot of the focus has been on undergrad in these discrepencies, but its more pronounces in grad programs. I once read, for instance, that MCAT score ranges for admitted Asians were around the 90% , while for Latinos it was around 60% (majority of whom are of course blanco/whites. Hispanic being a non existent category outsid eof the US)

It got me thinking. My family has doctors in it who  took immense risks, had to spend more time/capital (ie get another mastesr) to 're-brand' themselves for med school. $200k+ med school debt isn't unheard of, horrible living conditions to 'save', mental stress if they don't get in, etc.

Why is it that we are discussing 'student debt relief' before we discuss the non transparent admissions processes that discriminate asian americans? 

Because its now affecting the younger generation of whites.","asianamerican",7,"https://www.reddit.com/r/asianamerican/comments/cn5dgb/the_whole_student_debt_relief_movementhypocrisy/"
"OCR clears Princeton of anti-Asian discrimination in admissions.","2015-10-17",1445118368,"OCR clears Princeton of anti-Asian discrimination in admissions.","","asianamerican",8,"https://www.reddit.com/r/asianamerican/comments/3p5ps2/ocr_clears_princeton_of_antiasian_discrimination/"
"80/20 (Asian American advocacy PAC) needs our support!!","2015-07-11",1436649098,"80/20 (Asian American advocacy PAC) needs our support!!","80/20 is one of the few Asian American PACs that truly have our best interests at heart, but now they're struggling on life support and **WILL SHUT DOWN** without additional funding.  They were one of the 60 groups lobbying against Harvard for discrimination.

http://80-20initiative.blogspot.com/2015/07/either-sufficient-support-or-death.html?m=1

Q&amp;amp;A on the Life or Death of 80-20 PAC

Q1:  Why has 80-20 PAC chosen death rather than hanging on?

&gt;80-20 has seen many similar AsAm organizations providing negative service to our community. 80-20 PAC could one day become a negative-service organization. So it is better to cease operations  than struggle to hang on.

**Q2:  Negative service?  Could you give an example?**

&gt;**The support for ""race conscious"" college admissions by many so-called ""AsAm civil rights orgs"" is one example.** Even when discrimination against  AsAm  college applicants became so obvious  that school counselors have to advise our kids to hide their AsAm ethnic  background  when applying - a clear  indication that AsAms don't even have  the minimal human  rights of  self-respect, these civil right orgs still didn't change their position.  How ugly the real world can be!

**Q3:  Do these civil rights org. WANT to harm our community? (A must read!!)**

&gt;NO!  They drifted into it.  The first generation founders were usually volunteers &amp;amp; had noble  intentions .  But sooner or later, they  faded away.  The later leaders were usually paid a salary. They might not be as dedicated  and/or as capable. Lacking prestige, the subsequent  leaders couldn't raise enough money from the  AsAm community.   **So they  began to go after grants from the generous mainstream foundations  and corporations.**     

&gt;However, raising money  from American orgs, that support civil rights, is almost impossible WITHOUT THE BLESSINGS of  NAACP. NAACP has won civil rights for all minorities of America, including us.   However, does NAACP always have the same interests as AsAms?    No!!  That is when AsAm civil rights orgs would and will support policies at  the expense of AsAms.   Money talks!   Make it talk for us.

Q4:  So is it the fault of these civil rights orgs?

&gt;NO!   The subsequent leaders of our civil rights orgs are mostly new college graduates.  They may be too young to face the tough real world.  

&gt;Personally, I primarily blame the successful AsAm business leaders  who, as a group, don't have the wisdom to bear the responsibility of financing  the  necessary community infrastructures - PACs, civil rights orgs, &amp;amp; think-tanks.

&gt;Instead, our rich  people compete  to give money to Harvard and buy a name on a Harvard  building.   A recent NY Times satire, entitled ""Harvard Admissions Needs 'Moneyball for Life' ""  stated: 
      
&gt;"" They (meaning the rich people who climb over each other to donate to Harvard)  weren't  put on earth to alleviate human suffering, or to make it a different and  better place. They were put on earth  to erect a building  with their name on it, in a place it  can be  seen and admired by other people like  them!""   

&gt;Please ""google"" to find out which wealthy AsAms are these belittled moneyballs. 

&gt;   The unwillingness of AsAm rich and powerful to invest in our community contrasts strikingly other minority communities.  Most AsAms are NOT willing to speak out on this point  for fear of offending these folks.  However, someone has to point out this HUGE weakness.  

              ""To those whom much is given, much is required."" 
                             -  John F. Kennedy, a Harvard graduate



80/20 has been one of our community's most staunch pro-Asian PACs for decades, and it didn't sell out like a lot of our other activist organizations that were desperate for funding.  Now is the time to make your commitment clear?  Please donate to help keep this organization alive, it's literally Zion and they're under siege by the Machines.  If they collapse, then one of the last bulwarks we have against White Supremacy is going to be destroyed.  I'm calling out to all Asian America.


^Credit ^goes ^to ^/u/Disciple888 ^for ^this ^post","asianamerican",20,"https://www.reddit.com/r/asianamerican/comments/3cy6wm/8020_asian_american_advocacy_pac_needs_our_support/"
"[Discussion] I don't see why the affirmative action issue is constantly framed as a conflict of interest between minorities.","2014-01-14",1389675579,"[Discussion] I don't see why the affirmative action issue is constantly framed as a conflict of interest between minorities.","When I see AAs arguing against affirmative action, most immediately go with the assumption that this is a conflict between minorities. They see their opponents are other underprivileged minorities who gets all the positions that they didn't get. The proposed solution that they give is always complete abolition, which I see as unlikely, especially in more liberal states.

I think the angle of approach to this issue needs to change in order to convince more people. Don't think of this problem as a dog-eat-dog contest between minorities. There are actually fairly good arguments for helping historically disadvantaged African Americans and Hispanics. It is hard to defeat it.

Instead the really unfair part of affirmative action (for me) is the fact that AAs actually have a HARDER time than Caucasians in this system. This makes absolutely no sense. Caucasians get white privilege, pre-existing old-boy social networks and historical legacy benefits, while AAs suffered historical discrimination and higher poverty rate, AND they should be given an even harder time now compared to white people? I am really surprised and disgruntled that this is not pointed out more whenever affirmative action is brought up.

If the admission rates of Caucasians and AAs for colleges are on the same level adjusted for test score (or in some better measure of admission equality, we are equal), I would be perfectly fine with affirmative action. It is a reasonable statement that white people don't need a crutch in life over Asians, right?

This point could have been chewed to death in some AA blog circles. I haven't been in the AA activism community for too long, so it is likely that I missed it. However, I have never seen it presented online, so I thought to get some discussions on it.","asianamerican",40,"https://www.reddit.com/r/asianamerican/comments/1v63z3/discussion_i_dont_see_why_the_affirmative_action/"
